{
  "schema_version": "1.0",
  "project_slug": "pedicel-marketing-redesign-smoke",
  "generated_at": "2026-07-27T15:55:45.711204Z",
  "model": "MiniMax-M3",
  "layout_thesis": {
    "statement": "A confessional-teacher's workbook: the page reads like a quiet lesson on what makes a brand unique, with the gold 'i' dot from the logo acting as a moving highlighter that travels down the page to mark every lesson and every sentence that lands.",
    "audience": "Small-to-mid business owners evaluating an inbound marketing and branding partner; people who distrust hype and want a calm, opinionated teacher to walk them through what 'customised' actually means.",
    "job_to_be_done": "Convert skeptical first-time visitors into qualified discovery-call bookings by proving the agency's point of view in the page itself \u2014 not in a 'why us' block.",
    "why_this_not_generic": "Stock agency templates lead with a centered hero, a three-icon service grid, and a 'trusted by' wall. The brand's own voice ('All brands are unique, they just haven't shown it to the world yet' / 'Limitless.' / 'customised from top to bottom') is a teacher's voice, not a competitor's. The layout must therefore behave like a margin-noted textbook, not a pitch deck. The gold dot is a literal carryover from the logo's most distinctive feature (the dot above the 'i' in 'Pedicel') and is the only saturated color the brand actually owns \u2014 using it as a navigational marker is more honest than burying it in a button."
  },
  "sections": [
    {
      "id": "cover",
      "order": 0,
      "nav_label": null,
      "in_nav": false,
      "purpose": "Set the teacher-register tone and introduce the signature gold-dot highlighter in its largest, slowest form.",
      "component": "Asymmetric editorial cover: left 60% holds a single sentence-case belief statement at display size; right 40% holds a vertical 'lesson index' (services list treated like chapter titles) with the gold dot sitting beside the first item. No centered hero, no stock imagery, no CTA button above the fold \u2014 the page is read, not pitched to.",
      "emphasis": "hero",
      "source_brief_fields": [
        "voice_and_tone.register",
        "voice_and_tone.example_lines",
        "voice_and_tone.sentence_case",
        "palette_from_logo.primary",
        "palette_from_logo.secondary",
        "typography_recommendation.display_family"
      ],
      "rationale": "The brand's strongest recoverable copy is one short sentence ('All brands are unique, they just haven't shown it to the world yet.'). Leading with it at display size, in sentence case, with no chrome around it, is the most on-voice choice. Putting the gold dot on the lesson index makes the signature element discoverable in the first screen without ever being labeled as a logo feature."
    },
    {
      "id": "manifesto",
      "order": 1,
      "nav_label": "Manifesto",
      "in_nav": true,
      "purpose": "State the agency's teaching philosophy in long-form, using the teacher's margin-note cadence.",
      "component": "Two-column editorial: a narrow left column (28%) holds a sticky numbered index of short manifesto statements; a wide right column (72%) shows one full paragraph per statement with the gold dot as a margin marker beside each paragraph number. Footnote-style attribution appears under each paragraph. | REVISION: Replace the standalone h2 + paragraph with a two-column 'workbook page' layout at >=1024px: left column keeps the h2 and short paragraph, right column becomes a 240px-wide teacher-margin note column carrying a large numeral '01' and the signature gold dot fixed to its baseline. | REVISION: break this section's rhythm by replacing the plain h2 + paragraph with a chapter-opening treatment: large numeral ('I' or '01') left-aligned in the margin, the existing subhead as a pull line, then a narrow body column capped at ~52ch; add a second gold dot in the right margin next to the numeral. | REVISION: Convert 'What we believe, before you read anything else.' from a one-line h2 into a two-column layout at >=1024px: an italicised serif pull-quote on the right (~55% wide) and a 3-item sentence-case belief list on the left, replacing the single 2-sentence paragraph.",
      "emphasis": "primary",
      "source_brief_fields": [
        "voice_and_tone.register",
        "voice_and_tone.notes",
        "voice_and_tone.favorite_words",
        "voice_and_tone.banned_words",
        "voice_and_tone.avg_sentence_length_words"
      ],
      "rationale": "Confessional-educational voice is best shown, not declared. A numbered list of belief-statements, written at the brand's actual ~13-word average sentence length, lets the voice carry the section without resorting to testimonials (which the brief flags as unrecoverable). | Revision rationale: The layout thesis explicitly describes a workbook with margin notes and a traveling highlighter; today the manifesto is a generic centered block. Splitting it into body + margin column activates the workbook metaphor on the first content section after the hero. | Revision rationale: right now the manifesto and the uniqueness-lesson heading use visually identical subhead weight and shape, so the page has no chapter rhythm; a numeral + margin dot makes this section read as a chapter opening rather than a generic blog paragraph. | Revision rationale: Currently 'What we believe' is followed by a single short paragraph, which is exactly the shape the thesis asks the page to avoid \u2014 a list and a pull-quote turn it into the teacher-margin note the brand voice promises."
    },
    {
      "id": "uniqueness-lesson",
      "order": 2,
      "nav_label": "The lesson",
      "in_nav": true,
      "purpose": "Teach the visitor the agency's core framework (the thing every 'unique' brand has to do) without calling it a framework.",
      "component": "Four-step teaching block laid out as a vertical timeline rather than a horizontal grid. Each step is a numbered card with a single-sentence rule, a one-line example, and the gold dot acting as the step's bullet. On wide screens the timeline is centered with generous gutter; on narrow screens it collapses to a single column but keeps the dot. | REVISION: Introduce a numbered chapter-opening treatment: prepend a large ~120px serif or display '01' numeral in the left margin, and pin the gold signature dot 16px to the right of the numeral so it visually functions as the i-dot highlighter beside the lesson number.",
      "emphasis": "primary",
      "source_brief_fields": [
        "voice_and_tone.example_lines",
        "voice_and_tone.favorite_words",
        "palette_from_logo.primary",
        "palette_from_logo.secondary",
        "brand_donts"
      ],
      "rationale": "The brief's first explicit banned default is the three-column feature grid with icons. A vertical numbered timeline is the same information density without the template fingerprint, and it lets the gold dot carry meaning instead of decoration. | Revision rationale: The thesis states the gold dot should travel beside every lesson number. This section is literally called the 'uniqueness lesson' yet has no number and no dot, breaking the brand's own reading-guide metaphor."
    },
    {
      "id": "services-as-chapters",
      "order": 3,
      "nav_label": "What we do",
      "in_nav": true,
      "purpose": "Present the eight public services as chapters of a customised curriculum rather than a service catalog.",
      "component": "Expandable chapter list (accordion with persistent chapter numbers). Each chapter title is one of the eight LinkedIn-listed services; opening a chapter reveals a short teacher-style explanation of when that chapter is needed and what it produces. The gold dot marks the chapter currently being read. | REVISION: Break the single-paragraph section rhythm by rendering the four services as four stacked 'chapter' rows: each row pairs a large left-margin number (01\u201304) with a sentence-case h3 and one-line description, separated by thin 1px hairlines and pinned to the signature gold dot via a fixed left rail. | REVISION: render each service as a numbered chapter row with the gold dot anchored to the row's left margin, an oversized numeral ('01', '02', '03', '04'), a sentence-case title, and a single 1-2 line teacher-margin note set in italic to the right of the title at desktop widths. | REVISION: Restructure each service as a numbered chapter block with a large gold numeral (e.g. '01', '02', '03') in the left margin and a chapter title in display weight, separated by horizontal rules, instead of a single heading + paragraph shape. | REVISION: Lay the 'four things every unique brand has done' out as a 2x2 grid at >=1024px (single column on mobile), with each cell prefixed by a numeral '01\u201304' in the bold display size and the gold dot positioned as a fixed margin marker beside whichever cell is in view.",
      "emphasis": "primary",
      "source_brief_fields": [
        "service_facts",
        "voice_and_tone.register",
        "voice_and_tone.formality_score_1to5"
      ],